{
 "instance": "stub_v2",
 "seed": 0,
 "tier": "default",
 "schema_version": "2",
 "mechanism": {
  "params": {
   "k_cool.A": {
    "value": 0.08,
    "abs_tol": 0.008,
    "rel_tol": 0.1,
    "unit": "degC/min"
   },
   "k_cool.B": {
    "value": 0.06,
    "abs_tol": 0.006,
    "rel_tol": 0.1,
    "unit": "degC/min"
   },
   "k_cool.C": {
    "value": 0.1,
    "abs_tol": 0.01,
    "rel_tol": 0.1,
    "unit": "degC/min"
   },
   "k_leak.A": {
    "value": 0.01,
    "abs_tol": 0.001,
    "rel_tol": 0.1,
    "unit": "1/min"
   },
   "k_leak.B": {
    "value": 0.012,
    "abs_tol": 0.0012,
    "rel_tol": 0.1,
    "unit": "1/min"
   },
   "k_leak.C": {
    "value": 0.008,
    "abs_tol": 0.0008,
    "rel_tol": 0.1,
    "unit": "1/min"
   },
   "H.A": {
    "value": 1.2,
    "abs_tol": 0.2,
    "rel_tol": 0.1,
    "unit": "degC"
   },
   "H.B": {
    "value": null,
    "abs_tol": 0.2,
    "rel_tol": 0.1,
    "unit": "degC",
    "undeterminable": true,
    "fact_id": "U05",
    "hypotheses": [
     "H.B in [0.2, 1.0) degC",
     "H.B in [1.0, 2.0] degC"
    ]
   },
   "H.C": {
    "value": 1.6,
    "abs_tol": 0.2,
    "rel_tol": 0.1,
    "unit": "degC"
   },
   "bias.A": {
    "value": 0.3,
    "abs_tol": 0.2,
    "rel_tol": 0.1,
    "unit": "degC"
   },
   "bias.B": {
    "value": -0.5,
    "abs_tol": 0.2,
    "rel_tol": 0.1,
    "unit": "degC",
    "undeterminable": true,
    "fact_id": "U04",
    "hypotheses": [
     "bias.B in [-1.5, 0) degC",
     "bias.B in [0, 1.5] degC"
    ]
   },
   "bias.C": {
    "value": 1.1,
    "abs_tol": 0.2,
    "rel_tol": 0.1,
    "unit": "degC"
   },
   "door_gain": {
    "value": 5.0,
    "abs_tol": 0.5,
    "rel_tol": 0.15,
    "unit": "ratio"
   },
   "c_adj": {
    "value": 0.005,
    "abs_tol": 0.001,
    "rel_tol": 0.2,
    "unit": "1/min"
   },
   "defrost.R_hours": {
    "value": 7,
    "abs_tol": 0.5,
    "rel_tol": 0.0,
    "unit": "hours"
   },
   "defrost.len_min": {
    "value": 18,
    "abs_tol": 2,
    "rel_tol": 0.0,
    "unit": "min"
   },
   "defrost.heat_degC": {
    "value": 3.0,
    "abs_tol": 0.5,
    "rel_tol": 0.0,
    "unit": "degC"
   },
   "trip.d_min": {
    "value": 6,
    "abs_tol": 1,
    "rel_tol": 0.0,
    "unit": "min"
   },
   "lockout.N": {
    "value": 4,
    "abs_tol": 0,
    "rel_tol": 0.0,
    "unit": "count"
   },
   "lockout.W_min": {
    "value": 45,
    "abs_tol": 5,
    "rel_tol": 0.0,
    "unit": "min"
   },
   "lockout.L_min": {
    "value": 120,
    "abs_tol": 10,
    "rel_tol": 0.0,
    "unit": "min"
   }
  },
  "rules": {
   "defrost_rule_type": "runtime_hours",
   "stagger_order": [
    "C",
    "A",
    "B"
   ],
   "adjacency_pairs": [
    [
     "A",
     "B"
    ],
    [
     "B",
     "C"
    ]
   ]
  }
 },
 "protocol": {
  "checksum": "xor",
  "tick_unit_s": 60,
  "types": {
   "11": "STATUS",
   "21": "DOOR",
   "22": "TRIP",
   "23": "LOCKOUT",
   "24": "DEFROST",
   "25": "HEATER",
   "30": "BOOT",
   "31": "SETPOINT",
   "3F": "QUEUE_OVERFLOW"
  },
  "status_words": [
   "AIR_TEMP",
   "COIL_TEMP",
   "DISCH_PRESSURE",
   "STATE_FLAGS"
  ],
  "temp_scale": 10,
  "temp_offset": 500,
  "press_scale": 10,
  "flag_bits": {
   "RUN": 0,
   "DEFROST": 1,
   "LOCKOUT": 2,
   "RECOVERY": 3,
   "DOOR_OPEN": 4,
   "ABS_TEMP": 15
  },
  "event_words": {
   "DOOR": {
    "0001": "OPEN",
    "0000": "CLOSED"
   },
   "LOCKOUT": {
    "0001": "ENTER",
    "0000": "EXIT"
   },
   "DEFROST": {
    "0001": "ENTER",
    "0000": "EXIT"
   },
   "HEATER": {
    "0001": "ON",
    "0000": "OFF"
   },
   "BOOT": {
    "0032": "3.2",
    "0034": "3.4"
   }
  },
  "known": [
   [
    "11",
    "AIR_TEMP"
   ],
   [
    "11",
    "STATE_FLAGS"
   ]
  ],
  "v34_change": "absolute_temp",
  "controller_clock_epoch": {
   "K7-03": "2026-03-01T00:00:00Z"
  },
  "heldout": [
   {
    "seq": 2,
    "ts": "2026-03-08T01:10:00Z",
    "zone": "C",
    "event": "DOOR",
    "value": null,
    "tol_value": 0.2,
    "tol_s": 120
   },
   {
    "seq": 3,
    "ts": "2026-03-08T01:15:00Z",
    "zone": "C",
    "event": "AIR_TEMP",
    "value": -6.4,
    "tol_value": 0.2,
    "tol_s": 120
   }
  ]
 },
 "facts": [
  {
   "id": "F01",
   "topic": "excursion_zone",
   "kind": "determinable",
   "question": "Which zone had the temperature excursion?",
   "answer": "zone C (controller K7-03)",
   "evidence_for": [
    "deploy/logs/gateway.log",
    "db/ledger.sql"
   ]
  },
  {
   "id": "F02",
   "topic": "excursion_start",
   "kind": "determinable",
   "question": "When did the zone C excursion start (UTC)?",
   "answer": "2026-03-08T01:05Z (within 15 min)",
   "evidence_for": [
    "deploy/logs/gateway.log",
    "controller/zoneC_ringbuffer.txt"
   ]
  },
  {
   "id": "F03",
   "topic": "door_prop_actor",
   "kind": "determinable",
   "question": "Who propped the zone C door open on the incident night?",
   "answer": "actor:t.nguyen, at about 00:52 UTC on 2026-03-08",
   "evidence_for": [
    "people/badge_access.csv",
    "people/cctv_motion.csv"
   ]
  },
  {
   "id": "F04",
   "topic": "firmware_version",
   "kind": "determinable",
   "question": "Which firmware version was flashed on the zone C controller on 2026-03-06?",
   "answer": "3.4 (absolute-temperature encoding), flashed by the vendor technician at about 14:30 UTC",
   "evidence_for": [
    "deploy/logs/gateway.log",
    "people/chat_export.json"
   ]
  },
  {
   "id": "F05",
   "topic": "alert_suppression",
   "kind": "determinable",
   "question": "Which configuration change suppressed the zone C alerts?",
   "answer": "ALERT_MIN_SEVERITY in config.override.yml, deployed by actor:s.patel via an override deploy at 2026-03-07T02:11Z",
   "evidence_for": [
    "repo/config.override.yml",
    "deploy/logs/gateway.log"
   ]
  },
  {
   "id": "F06",
   "topic": "affected_lots",
   "kind": "determinable",
   "question": "Which lots were affected by the excursion?",
   "answer": "lot:LN-24019 and lot:LN-24020 (the postmortem lists only LN-24019)",
   "evidence_for": [
    "db/ledger.sql",
    "deploy/logs/gateway.log"
   ]
  },
  {
   "id": "F07",
   "topic": "lockout_N",
   "kind": "determinable",
   "question": "How many consecutive trips trigger a lockout (lockout.N)?",
   "answer": 4,
   "tol": 0,
   "evidence_for": [
    "deploy/logs/gateway.log",
    "controller/zoneC_ringbuffer.txt"
   ]
  },
  {
   "id": "U01",
   "topic": "wedge_removal_actor",
   "kind": "undeterminable",
   "question": "Who removed the wedge from the zone C door in the morning?",
   "answer": null,
   "hypotheses": [
    "actor:t.nguyen (returned at end of shift)",
    "actor:j.okafor (night lead, morning walk-round)"
   ],
   "supported": "someone removed the wedge between 04:10 and 04:40 (door CLOSED frame, temperature recovery)",
   "why_undeterminable": "badge reader ZONE-C offline from 03:00 (ticket T-0412); CCTV export covers only 22:00-03:00",
   "trap_claims": [
    {
     "doc_id": "doc:night_lead",
     "claim_id": "tc01",
     "text": "nobody opened it again until morning"
    }
   ],
   "evidence_for": [
    "deploy/logs/gateway.log"
   ],
   "evidence_missing": [
    "people/badge_access.csv (ZONE-C rows after 03:00)",
    "people/cctv_motion.csv (after 03:00)"
   ]
  },
  {
   "id": "U02",
   "topic": "compressor_condition",
   "kind": "undeterminable",
   "question": "Was the zone C compressor mechanically degraded before the incident?",
   "answer": null,
   "hypotheses": [
    "yes: worn bearings (the rough sound reported in chat)",
    "no: the sound was normal defrost cycling"
   ],
   "supported": "the compressor ran and the discharge pressure stayed in band throughout",
   "why_undeterminable": "no vibration log exists; the vendor service report for February is missing from the evidence",
   "trap_claims": [
    {
     "doc_id": "doc:postmortem",
     "claim_id": "tc02",
     "text": "zone C compressor failure"
    }
   ],
   "evidence_for": [
    "people/chat_export.json"
   ],
   "evidence_missing": [
    "people/vendor_service_report_feb.pdf",
    "controller/vibration.csv"
   ]
  },
  {
   "id": "U03",
   "topic": "override_authorisation",
   "kind": "undeterminable",
   "question": "Who authorised the 2026-03-07 02:11 override deploy?",
   "answer": null,
   "hypotheses": [
    "actor:s.patel self-authorised",
    "actor:m.rivera approved verbally on the phone"
   ],
   "supported": "the deploy was run from s.patel's account with the emergency flag",
   "why_undeterminable": "the #ops-night channel was archived before export; no ticket references the deploy",
   "trap_claims": [],
   "evidence_for": [
    "deploy/logs/gateway.log"
   ],
   "evidence_missing": [
    "people/chat_export.json (#ops-night, archived)",
    "people/tickets.json (no deploy ticket)"
   ]
  },
  {
   "id": "U04",
   "topic": "bias.B",
   "kind": "undeterminable",
   "question": "What is the air-temperature sensor bias of room B (bias.B, degC)?",
   "answer": null,
   "hypotheses": [
    "bias.B in [-1.5, 0) degC",
    "bias.B in [0, 1.5] degC"
   ],
   "supported": "rooms A and C were probe-checked; room B was never probed",
   "why_undeterminable": "no reference probe reading exists for room B, so its bias is not separable from its setpoint",
   "trap_claims": [],
   "evidence_for": [
    "people/probe_checks.csv"
   ],
   "evidence_missing": [
    "people/probe_checks.csv (room B rows)"
   ]
  },
  {
   "id": "U05",
   "topic": "H.B",
   "kind": "undeterminable",
   "question": "What is the door heat-load coefficient of room B (H.B, degC)?",
   "answer": null,
   "hypotheses": [
    "H.B in [0.2, 1.0) degC",
    "H.B in [1.0, 2.0] degC"
   ],
   "supported": "room B doors were never opened for longer than 30 s during the replay",
   "why_undeterminable": "no sustained room B door-open window exists in the logs, so H.B has no identifiable signal",
   "trap_claims": [],
   "evidence_for": [
    "deploy/logs/gateway.log"
   ],
   "evidence_missing": [
    "deploy/logs/gateway.log (room B DOOR open > 5 min)"
   ]
  },
  {